Sheet: Таблица авторов перепутать
A3: Названия строк | B3: Количество по полю Количество
B4: 1
A5: Александр Генис | B5: 1
A6: Александр Кабаков | B6: 1
A7: Александр Терехов | B7: 1
A8: Алла Сурикова | B8: 1
A9: Анатолий Трушкин | B9: 1
A10: Андрей Волос | B10: 1
A11: Андрей Рубанов | B11: 1
A12: Анна Новопольцева | B12: 1
A13: Аркадий Стругацкий, Борис Стругацкий | B13: 1
A14: Бенедикт Сарнов | B14: 1
A15: Борис Васильев | B15: 2
A16: Борис Грищенко | B16: 1
A17: В. Г. Лидин | B17: 1
A18: В. Щербань | B18: 1
A19: Валерий Попов | B19: 1
A20: Василий Аксенов | B20: 1
A21: Василий Гроссман | B21: 1
A22: Василий Катанян | B22: 1
A23: Виль Липатов | B23: 1
A24: Владимир Войнович | B24: 1
A25: Владимир Шахиджанян | B25: 1
A26: Георгий Владимов | B26: 1
A27: Дарья Донцова | B27: 2
A28: Е. С. Гинзбург | B28: 1
A29: Елизавета Козырева | B29: 1
A30: Захар Прилепин | B30: 1
A31: Зоя Кошелева | B31: 1
A32: Ирина Краева | B32: 1
A33: Ирина Ратушинская | B33: 1
A34: коллективный | B34: 1
A35: Л. С. Петрушевская | B35: 1
A36: Марианна Баконина | B36: 1
A37: Мария Рыбакова | B37: 1
A38: Маша Трауб | B38: 1
A39: Михаил Веллер | B39: 1
A40: Михаил Успенский | B40: 1
A41: Н. И. Ильина | B41: 1
A42: Наталья Александрова | B42: 1
A43: Ольга Новикова | B43: 2
A44: Петр Алешковский | B44: 1
A45: Сергей Болмат | B45: 1
A46: Сергей Осипов | B46: 1
A47: Татьяна Сахарова | B47: 1
A48: Эдвард Радзинский | B48: 2
A49: Эмма Герштейн | B49: 1
A50: (пусто)
A51: Общий итог | B51: 50

Sheet: Результаты поиска
B1: Reversed left context | C1: Reversed center | D1: Left context | E1: Center | F1: Punct | G1: Right context | H1: Title | I1: Количество | J1: Author | K1: Birthday | L1: Header | M1: Created | N1: Sphere | O1: Type | P1: Topic | Q1: Publication | R1: Publ_year | S1: Medium | T1: Ambiguity | U1: Full context
A2: =ROUND((RAND()*100),2) -> 4.7 | B2: и илитропси есв адгесв как | C2: илатупереп | D2: как всегда, все испортили и | E2: перепутали | F2: , | G2: а вы двинетесь дальше, навстречу | H2: Михаил Успенский. Там, где нас нет (1995) | I2: =IF(R[1]C[1]=RC[1], "", 1) -> 1 | J2: Михаил Успенский | K2: 1950 | L2: Там, где нас нет | M2: 1995 | N2: художественная | O2: роман | Q2: Успенский М. Там, где нас нет | R2: 2002 | S2: книга | T2: омонимия не снята | U2: ― Хотелось бы предстать перед вами в подлинном виде, но, увы… Эти болваны, как всегда, все испортили и перепутали, а вы двинетесь дальше, навстречу своей бессмысленной судьбе… [Михаил Успенский. Там, где нас нет (1995)] [омонимия не снята]
A3: =ROUND((RAND()*100),2) -> 75.3 | B3: от-как узарс онтсогят олыб отЭ | C3: олатупереп | D3: Это было тягостно, сразу как-то | E3: перепутало | G3: годы, как перемешивают костяшки перед | H3: В. Г. Лидин. Прилет птиц (1962) | I3: =IF(R[1]C[1]=RC[1], "", 1) -> 1 | J3: В. Г. Лидин | K3: 1892 | L3: Прилет птиц | M3: 1962 | N3: художественная | O3: рассказ | Q3: Советский рассказ (Серия БВЛ). Т. 2 | R3: 1975 | S3: книга | T3: омонимия не снята | U3: Это было тягостно, сразу как-то перепутало годы, как перемешивают костяшки перед игрой в домино, и после войны оказалось, что многие из сверстников, с кем Лариса Васильевна кончала школу, погибли, погиб и Миша Неустроев, которого она любила. [В. Г. Лидин. Прилет птиц (1962)] [омонимия не снята]
A4: =ROUND((RAND()*100),2) -> 58.43 | B4: зар урап улазков оп яанружеД | C4: алатупереп | D4: Дежурная по вокзалу пару раз | E4: перепутала | G4: путь, на который принимался поезд | H4: Александр Терехов. Страх перед морозом // Библиотека «Огонек», 1989 | I4: =IF(R[1]C[1]=RC[1], "", 1) -> 1 | J4: Александр Терехов | K4: 1966 | L4: Страх перед морозом | M4: 1989 | N4: художественная | O4: рассказ | Q4: Библиотека «Огонек» | R4: 1989 | S4: журнал | T4: омонимия не снята | U4: Дежурная по вокзалу пару раз перепутала путь, на который принимался поезд. [Александр Терехов. Страх перед морозом // Библиотека «Огонек», 1989] [омонимия не снята]
A5: =ROUND((RAND()*100),2) -> 8.41 | B5: есв от а йенд урап | C5: театупереп | D5: пару дней ― а то все | E5: перепутает | F5: . | H5: Анна Новопольцева. У них там Кремль есть. Красный такой! (1995) // «Общая газета», 1995.07.26 | I5: =IF(R[1]C[1]=RC[1], "", 1) -> 1 | J5: Анна Новопольцева | L5: У них там Кремль есть. Красный такой! | M5: 1995 | N5: публицистика , нехудожественная | O5: очерк | P5: путешествия | Q5: «Общая газета» | R5: 1995.07.26 | S5: газета | T5: омонимия не снята | U5: Главное, не пытаться протащить его по ним за пару дней ― а то все перепутает. [Анна Новопольцева. У них там Кремль есть. Красный такой! (1995) // «Общая газета», 1995.07.26] [омонимия не снята]
A6: =ROUND((RAND()*100),2) -> 1.64 | B6: тежоМ ларбан я ремон ил | C6: латупереп | D6: ли номер я набрал. Может, | E6: перепутал | F6: ? | G6: Так оно и было. | H6: Борис Грищенко. Посторонний в Кремле (2004) | I6: =IF(R[1]C[1]=RC[1], "", 1) -> 1 | J6: Борис Грищенко | K6: 1937 | L6: Посторонний в Кремле | M6: 2004 | N6: публицистика , нехудожественная | O6: мемуары | P6: политика и общественная жизнь | Q6: Борис Грищенко. Посторонний в Кремле | R6: 2004 | S6: книга | T6: омонимия не снята | U6: И тут меня осенило: правильный ли номер я набрал. Может, перепутал? Так оно и было. [Борис Грищенко. Посторонний в Кремле (2004)] [омонимия не снята]
A7: =ROUND((RAND()*100),2) -> 68.260000000000005 | B7: ен огечин онйачулс кичьлам ыТ | C7: латупереп | D7: Ты, мальчик, случайно ничего не | E7: перепутал | F7: ? | G7: Тим только головой покачал, жмурясь | H7: Ирина Краева. Тим и Дан, или Тайна «Разбитой коленки»: сказочная повесть (2007) | I7: =IF(R[1]C[1]=RC[1], "", 1) -> 1 | J7: Ирина Краева | K7: 1966 | L7: Тим и Дан, или Тайна «Разбитой коленки»: сказочная повесть | M7: 2007 | N7: художественная | O7: сказка | Q7: Краева Ирина. Тим и Дан, или Тайна «Разбитой коленки»: сказочная повесть | R7: 2007 | S7: книга | T7: омонимия не снята | U7: Он застыл горячей стеклянной глыбой. ― Ты, мальчик, случайно ничего не перепутал? Тим только головой покачал, жмурясь от боли. [Ирина Краева. Тим и Дан, или Тайна «Разбитой коленки»: сказочная повесть (2007)] [омонимия не снята]
A8: =ROUND((RAND()*100),2) -> 12.59 | B8: воклок хесв ос вырс укьлоксоп | C8: латупереп | D8: поскольку срыв со всех колков | E8: перепутал | G8: всю пряжу, которую так долго | H8: Борис Васильев. Ольга, королева русов (2002) | I8: =IF(R[1]C[1]=RC[1], "", 1) -> 1 | J8: Борис Васильев | K8: 1924 | L8: Ольга, королева русов | M8: 2002 | N8: художественная | O8: роман | Q8: Борис Васильев. «Ольга, королева русов» | R8: 2002 | S8: книга | T8: омонимия не снята | U8: Инициатива исходила отнюдь не от сорвавшегося со всех колков князя Игоря, а от самого Кисана, поскольку срыв со всех колков перепутал всю пряжу, которую так долго и любовно прял первый боярин. [Борис Васильев. Ольга, королева русов (2002)] [омонимия не снята]
A9: =ROUND((RAND()*100),2) -> 90.26 | B9: едг хыннечюлказ йетед ялд вомодтед | C9: илатупереп | D9: детдомов для детей заключенных, где | E9: перепутали | G9: его фамилию. | H9: Е. С. Гинзбург. Крутой маршрут: Часть 1 (1967) | I9: =IF(R[1]C[1]=RC[1], "", 1) -> 1 | J9: Е. С. Гинзбург | K9: 1906 | L9: Крутой маршрут: Часть 1 | M9: 1967 | N9: публицистика , нехудожественная | O9: мемуары | Q9: Евгения Гинзбург. Крутой маршрут | R9: 1990 | S9: книга | T9: омонимия не снята | U9: Только много позднее, уже на Колыме, я узнала, что в то время, когда мама писала: «Васе под Новый год сделали елочку», на самом деле Вася был потерян в недрах детдомов для детей заключенных, где перепутали его фамилию. [Е. С. Гинзбург. Крутой маршрут: Часть 1 (1967)] [омонимия не снята]
A10: =ROUND((RAND()*100),2) -> 80.14 | B10: ёсв анйов яатялкорп атЭ | C10: алатупереп | D10: Эта проклятая война всё | E10: перепутала | F10: , | G10: всё смешала. | H10: Василий Гроссман. Жизнь и судьба, часть 2 (1960) | I10: =IF(R[1]C[1]=RC[1], "", 1) -> 1 | J10: Василий Гроссман | K10: 1905 | L10: Жизнь и судьба, часть 2 | M10: 1960 | N10: художественная | O10: роман | Q10: Гроссман В. Жизнь и судьба | R10: 1992 | S10: книга | T10: омонимия снята | U10: Эта проклятая война всё перепутала, всё смешала. [Василий Гроссман. Жизнь и судьба, часть 2 (1960)] [омонимия снята]
A11: =ROUND((RAND()*100),2) -> 29.89 | B11: етевс ан есВ волакиШ лунходзв | C11: латупереп | D11: вздохнул Шикалов. ― Все на свете | E11: перепутал | F11: . | G11: Как Керенского звали? | H11: Владимир Войнович. Жизнь и необычайные приключения солдата Ивана Чонкина (1969-1975) | I11: =IF(R[1]C[1]=RC[1], "", 1) -> 1 | J11: Владимир Войнович | K11: 1932 | L11: Жизнь и необычайные приключения солдата Ивана Чонкина | M11: 1969-1975 | N11: художественная | O11: роман | Q11: Владимир Войнович. Жизнь и приключения солдата Чонкина | R11: 2000 | S11: книга | T11: омонимия не снята | U11: ― Путаешь, ― вздохнул Шикалов. ― Все на свете перепутал. Как Керенского звали? [Владимир Войнович. Жизнь и необычайные приключения солдата Ивана Чонкина (1969-1975)] [омонимия не снята]
A12: =ROUND((RAND()*100),2) -> 26.09 | B12: и яслибс йаГ оген ан | C12: латупереп | D12: на него. Гай сбился и | E12: перепутал | G12: слова. — Перестань на меня глазеть | H12: Аркадий Стругацкий, Борис Стругацкий. Обитаемый остров (1967-1969) | I12: =IF(R[1]C[1]=RC[1], "", 1) -> 1 | J12: Аркадий Стругацкий, Борис Стругацкий | K12: 1925, 1933 | L12: Обитаемый остров | M12: 1967-1969 | N12: художественная | O12: роман | R12: 2004 | S12: книга | T12: омонимия не снята | U12: Гай посмотрел на часы и неуверенным голосом запел: «Боевая Гвардия тяжелыми шагами…» Максим насмешливо смотрел на него. Гай сбился и перепутал слова. — Перестань на меня глазеть, — сердито сказал он. [Аркадий Стругацкий, Борис Стругацкий. Обитаемый остров (1967-1969)] [омонимия не снята]
A13: =ROUND((RAND()*100),2) -> 92.47 | B13: ыТ мокнебер с тиотс ядаН | C13: алатупереп | D13: Надя стоит с ребенком. Ты | E13: перепутала | G13: все на свете. (Садится, держась | H13: Л. С. Петрушевская. Уроки музыки (1973) | I13: =IF(R[1]C[1]=RC[1], "", 1) -> 1 | J13: Л. С. Петрушевская | K13: 1938 | L13: Уроки музыки | M13: 1973 | N13: художественная | O13: пьеса | Q13: Москва, Изд-во «Искусство», 1989 | R13: 1989 | S13: электронный текст | T13: омонимия не снята | U13: [Федор Иванович Козлов, муж] Там не Нина, там Надя стоит с ребенком. Ты перепутала все на свете. (Садится, держась за голову. ) [Л. С. Петрушевская. Уроки музыки (1973)] [омонимия не снята]
A14: =ROUND((RAND()*100),2) -> 38.32 | B14: аруШ яиневонходв ьдеречо алатсан и | C14: латупереп | D14: и настала очередь «вдохновения», Шура | E14: перепутал | G14: кассеты. | H14: Алла Сурикова. Любовь со второго взгляда (2001) | I14: =IF(R[1]C[1]=RC[1], "", 1) -> 1 | J14: Алла Сурикова | K14: 1940 | L14: Любовь со второго взгляда | M14: 2001 | N14: публицистика , нехудожественная | O14: мемуары | Q14: А. Сурикова. Любовь со второго взгляда | R14: 2002 | S14: книга | T14: омонимия не снята | U14: Когда шампанское было выпито, фрукты съедены и настала очередь «вдохновения», Шура перепутал кассеты. [Алла Сурикова. Любовь со второго взгляда (2001)] [омонимия не снята]
A15: =ROUND((RAND()*100),2) -> 74.83 | B15: есв ад латичыв от-едг хи | C15: латупереп | D15: их где-то вычитал, да все | E15: перепутал | F15: , | G15: когда рассказывал своим пацанкам. | H15: Георгий Владимов. Три минуты молчания (1969) | I15: =IF(R[1]C[1]=RC[1], "", 1) -> 1 | J15: Георгий Владимов | K15: 1931 | L15: Три минуты молчания | M15: 1969 | N15: художественная | O15: роман | Q15: Георгий Владимов. Три минуты молчания | R15: 2004 | S15: книга | T15: омонимия не снята | U15: Тоже сказочка, не лучше она и не хуже, чем у Васьки Бурова, который их где-то вычитал, да все перепутал, когда рассказывал своим пацанкам. [Георгий Владимов. Три минуты молчания (1969)] [омонимия не снята]
A16: =ROUND((RAND()*100),2) -> 36.07 | B16: Я | C16: алатупереп | D16: Я | E16: перепутала | F16: , | G16: не на кухне серебро оставила | H16: Дарья Донцова. Рождественский кролик (2011) | I16: =IF(R[1]C[1]=RC[1], "", 1) -> 1 | J16: Дарья Донцова | K16: 1952 | L16: Рождественский кролик | M16: 2011 | N16: художественная | O16: рассказ | Q16: «Новогодний детектив: сборник рассказов» | R16: 2011 | S16: книга | T16: омонимия не снята | U16: Я перепутала, не на кухне серебро оставила. [Дарья Донцова. Рождественский кролик (2011)] [омонимия не снята]
A17: =ROUND((RAND()*100),2) -> 5.52 | B17: еН алшыв акчозявуеН | C17: латупереп | D17: Неувязочка вышла. Не | E17: перепутал | G17: я, оказывается, цифры. Он же | H17: Елизавета Козырева. Дамская охота (2001) | I17: =IF(R[1]C[1]=RC[1], "", 1) -> 1 | J17: Елизавета Козырева | L17: Дамская охота | M17: 2001 | N17: художественная | O17: роман | Q17: Елизавета Козырева. Дамская охота | R17: 2001 | S17: книга | T17: омонимия не снята | U17: Неувязочка вышла. Не перепутал я, оказывается, цифры. Он же нам на правильный автомобиль и указал. [Елизавета Козырева. Дамская охота (2001)] [омонимия не снята]
A18: =ROUND((RAND()*100),2) -> 78.92 | B18: мод отсорп онйачулс оннешревос едзеъдоп | C18: илатупереп | D18: подъезде совершенно случайно, просто дом | E18: перепутали | F18: . | H18: Татьяна Сахарова. Добрая фея с острыми зубками (2005) | I18: =IF(R[1]C[1]=RC[1], "", 1) -> 1 | J18: Татьяна Сахарова | L18: Добрая фея с острыми зубками | M18: 2005 | N18: художественная | O18: роман | Q18: Т. В. Сахарова. Добрая фея с острыми зубками | R18: 2005 | S18: книга | T18: омонимия не снята | U18: Я и мой юрист оказались в том подъезде совершенно случайно, просто дом перепутали. [Татьяна Сахарова. Добрая фея с острыми зубками (2005)] [омонимия не снята]
A19: =ROUND((RAND()*100),2) -> 68.650000000000006 | B19: адохыв ямерв ов тситра нидО | C19: латупереп | D19: Один артист во время выхода | E19: перепутал | G19: дверь и… вместо сцены побежал | H19: В. Щербань. Балет: суперфинал в зале Чайковского // «Работница», 1988 | I19: =IF(R[1]C[1]=RC[1], "", 1) -> 1 | J19: В. Щербань | L19: Балет: суперфинал в зале Чайковского | M19: 1988 | N19: публицистика , нехудожественная | O19: отчет | P19: искусство и культура | Q19: «Работница» | R19: 1988 | S19: журнал | T19: омонимия не снята | U19: Один артист во время выхода перепутал дверь и… вместо сцены побежал за кулисы. [В. Щербань. Балет: суперфинал в зале Чайковского // «Работница», 1988] [омонимия не снята]
A20: =ROUND((RAND()*100),2) -> 90.56 | B20: ен окьлот илсЕ | C20: илатупереп | D20: Если только не | E20: перепутали | G20: мы тут кузницу знаний. | H20: Василий Аксенов. Негатив положительного героя (1996) | I20: =IF(R[1]C[1]=RC[1], "", 1) -> 1 | J20: Василий Аксенов | K20: 1932 | L20: Негатив положительного героя | M20: 1996 | N20: художественная | O20: роман | Q20: Аксенов В. Негатив положительного героя | R20: 1996 | S20: книга | T20: омонимия не снята | U20: Если только не перепутали мы тут кузницу знаний. [Василий Аксенов. Негатив положительного героя (1996)] [омонимия не снята]
A21: =ROUND((RAND()*100),2) -> 60.68 | B21: артсесдем яаняьп БРЦ йоксниУ иинеледто | C21: алатупереп | D21: отделении Уинской ЦРБ пьяная медсестра | E21: перепутала | G21: новорожденных, и Язиля Калимова вернулась | H21: Зоя Кошелева. Оттаявший круг (2003) // «Искусство кино», 2003.06.30 | I21: =IF(R[1]C[1]=RC[1], "", 1) -> 1 | J21: Зоя Кошелева | L21: Оттаявший круг | M21: 2003 | N21: публицистика , нехудожественная | O21: статья | P21: искусство и культура | Q21: «Искусство кино» | R21: 2003.06.30 | S21: журнал | T21: омонимия не снята | U21: 6 августа 1976 года в родильном отделении Уинской ЦРБ пьяная медсестра перепутала новорожденных, и Язиля Калимова вернулась домой с чужим ребенком. [Зоя Кошелева. Оттаявший круг (2003) // «Искусство кино», 2003.06.30] [омонимия не снята]
A22: =ROUND((RAND()*100),2) -> 22.29 | B22: онченоК | C22: тюатупереП | D22: Конечно! | E22: Перепутают | G22: с кем-нибудь, и все… Как | H22: Анатолий Трушкин. 208 избранных страниц (1990-2002) | I22: =IF(R[1]C[1]=RC[1], "", 1) -> 1 | J22: Анатолий Трушкин | K22: 1941 | L22: 208 избранных страниц | M22: 1990-2002 | N22: художественная | O22: миниатюра | Q22: Анатолий Трушкин. 208 избранных страниц | R22: 1999 | S22: книга | T22: омонимия не снята | U22: Конечно! Перепутают с кем-нибудь, и все… Как говорится, Бог дал, Бог взял. [Анатолий Трушкин. 208 избранных страниц (1990-2002)] [омонимия не снята]
A23: =ROUND((RAND()*100),2) -> 17.82 | B23: но мыроток с аталас зи | C23: латупереп | D23: из салата, с которым он | E23: перепутал | G23: капусту. | H23: Александр Генис. Довлатов и окрестности (1998) | I23: =IF(R[1]C[1]=RC[1], "", 1) -> 1 | J23: Александр Генис | K23: 1953 | L23: Довлатов и окрестности | M23: 1998 | N23: публицистика , нехудожественная | O23: мемуары | Q23: Генис А. Довлатов и окрестности | R23: 1999 | S23: книга | T23: омонимия не снята | U23: Умел он готовить и гороховый суп, а однажды, чтобы убедить жену Лену в трезвости, сварил ― взамен опрокинутой им же кастрюли ― щи из салата, с которым он перепутал капусту. [Александр Генис. Довлатов и окрестности (1998)] [омонимия не снята]
A24: =ROUND((RAND()*100),2) -> 89.46 | B24: но отЭ | C24: латупереп | D24: Это он | E24: перепутал | F24: ― | G24: он его с другого бока | H24: Михаил Веллер. Баллада о знамени (1983-1997) | I24: =IF(R[1]C[1]=RC[1], "", 1) -> 1 | J24: Михаил Веллер | K24: 1948 | L24: Баллада о знамени | M24: 1983-1997 | N24: художественная | O24: рассказ | Q24: Михаил Веллер. А вот те шиш! | R24: 1997 | S24: книга | T24: омонимия не снята | U24: Это он перепутал ― он его с другого бока прислонил. [Михаил Веллер. Баллада о знамени (1983-1997)] [омонимия не снята]
A25: =ROUND((RAND()*100),2) -> 72.97 | B25: от-мек с янем но аламудоп | C25: латупереп | D25: подумала, он меня с кем-то | E25: перепутал | F25: . | H25: Сергей Осипов. Страсти по Фоме. Книга первая. Изгой (1998) | I25: =IF(R[1]C[1]=RC[1], "", 1) -> 1 | J25: Сергей Осипов | L25: Страсти по Фоме. Книга первая. Изгой | M25: 1998 | N25: художественная | O25: роман | Q25: Сергей Осипов. Страсти по Фоме | R25: 2003 | S25: книга | T25: омонимия не снята | U25: Он так на меня набросился, что я подумала, он меня с кем-то перепутал. [Сергей Осипов. Страсти по Фоме. Книга первая. Изгой (1998)] [омонимия не снята]
A26: =ROUND((RAND()*100),2) -> 86.79 | B26: есв идюл еыпулГ арюлтеП атэ | C26: илатупереп | D26: эта Петлюра? Глупые люди, все | E26: перепутали | F26: . | G26: Где же Риммочка? | H26: Ирина Ратушинская. Одесситы (1998) | I26: =IF(R[1]C[1]=RC[1], "", 1) -> 1 | J26: Ирина Ратушинская | K26: 1954 | L26: Одесситы | M26: 1998 | N26: художественная | O26: роман | Q26: Ирина Ратушинская. Одесситы | R26: 1998 | S26: книга | T26: омонимия не снята | U26: Или эта Петлюра? Глупые люди, все перепутали. Где же Риммочка? [Ирина Ратушинская. Одесситы (1998)] [омонимия не снята]