Sheet: Результаты поиска
B1: Reversed left context | C1: Reversed center | D1: Left context | E1: Center | F1: Punct | G1: Right context | H1: Title | I1: Количество | J1: Author | K1: Birthday | L1: Header | M1: Created | N1: Sphere | O1: Type | P1: Topic | Q1: Publication | R1: Publ_year | S1: Medium | T1: Ambiguity | U1: Full context
A2: =ROUND((RAND()*100),2) -> 98.6 | B2: еН | C2: латупс | D2: Не | E2: спутал | G2: с прежними словами, Ты вдруг | H2: Борис Панкин. Жди меня // «Общая газета», 1998 | I2: =IF(R[1]C[1]=RC[1], "", 1) -> 1 | J2: Борис Панкин | K2: 1931 | L2: Жди меня | M2: 1998 | N2: публицистика , нехудожественная | O2: статья | P2: искусство и культура | Q2: «Общая газета» | R2: 1998 | S2: газета | T2: омонимия не снята | U2: Не спутал с прежними словами, Ты вдруг сказала мне «люблю» Почти спокойными губами. [Борис Панкин. Жди меня // «Общая газета», 1998] [омонимия не снята]
A3: =ROUND((RAND()*100),2) -> 83.36 | B3: но и ано алыб отэ | C3: латупс | D3: это была она и он | E3: спутал | F3: . | H3: Б. Л. Пастернак. Письма А. С. Эфрон (1948-1955) | I3: =IF(R[1]C[1]=RC[1], "", 1) -> 1 | J3: Б. Л. Пастернак | K3: 1890 | L3: Письма А. С. Эфрон | M3: 1948-1955 | N3: публицистика , нехудожественная | O3: письмо | P3: искусство и культура | S3: книга | T3: омонимия не снята | U3: У нас есть знакомая Ариадна Борисовна, может быть, это была она и он спутал. [Б. Л. Пастернак. Письма А. С. Эфрон (1948-1955)] [омонимия не снята]
A4: =ROUND((RAND()*100),2) -> 33 | B4: ен илетатич ишан и аласип | C4: тюатупс | D4: писала, и наши читатели не | E4: спутают | G4: этого Кржижановского со старым большевиком | H4: С. Гедройц. Юрий Буйда. Город Палачей. Сигизмунд Кржижановский. Собрание сочинений в 5 томах. Том третий // «Звезда», 2003 | I4: =IF(R[1]C[1]=RC[1], "", 1) -> 1 | J4: С. Гедройц | L4: Юрий Буйда. Город Палачей. Сигизмунд Кржижановский. Собрание сочинений в 5 томах. Том третий | M4: 2003 | N4: публицистика , нехудожественная | O4: рецензия | P4: искусство и культура | Q4: «Звезда» | R4: 2003 | S4: журнал | T4: омонимия не снята | U4: О первых двух томах «Звезда» уже писала, и наши читатели не спутают этого Кржижановского со старым большевиком, автором балета «ГОЭРЛО» и оперы «Варшавянка». [С. Гедройц. Юрий Буйда. Город Палачей. Сигизмунд Кржижановский. Собрание сочинений в 5 томах. Том третий // «Звезда», 2003] [омонимия не снята]
A5: =ROUND((RAND()*100),2) -> 13.84 | B5: но огот ешьлоБ 11 | C5: латупс | D5: 11 Больше того, он | E5: спутал | G5: социальные роли старца и странника | H5: Александр Архангельский. Александр I (2000) | I5: =IF(R[1]C[1]=RC[1], "", 1) -> 1 | J5: Александр Архангельский | K5: 1962 | L5: Александр I | M5: 2000 | N5: публицистика , нехудожественная | O5: монография | P5: наука и технологии, история | Q5: Александр Архангельский «Александр I» | R5: 2000 | S5: книга | T5: омонимия не снята | U5: 11 Больше того, он спутал социальные роли старца и странника. [Александр Архангельский. Александр I (2000)] [омонимия не снята]
A6: =ROUND((RAND()*100),2) -> 26.56 | B6: ен онченок коняломс уН | C6: ьшеатупс | D6: Ну «смолянок», конечно, не | E6: спутаешь | G6: и портрет Лопухиной не отнесешь | H6: В. А. Солоухин. Письма из Русского музея (1966) | I6: =IF(R[1]C[1]=RC[1], "", 1) -> 1 | J6: В. А. Солоухин | K6: 1924 | L6: Письма из Русского музея | M6: 1966 | N6: художественная | O6: эссе, цикл | Q6: Солоухин В. А. «Слово живое и мертвое» | R6: 1976 | S6: книга | T6: омонимия не снята | U6: Ну «смолянок», конечно, не спутаешь и портрет Лопухиной не отнесешь к Рокотову. [В. А. Солоухин. Письма из Русского музея (1966)] [омонимия не снята]
A7: =ROUND((RAND()*100),2) -> 53.69 | B7: Я йониьлИ юиретлагхуб в ьтиновз | C7: латупс | D7: звонить в бухгалтерию Ильиной: «Я | E7: спутал | F7: . | H7: Анатолий Найман. Славный конец бесславных поколений (1994) | I7: =IF(R[1]C[1]=RC[1], "", 1) -> 1 | J7: Анатолий Найман | K7: 1936 | L7: Славный конец бесславных поколений | M7: 1994 | N7: публицистика , нехудожественная | O7: мемуары | Q7: Найман А. Славный конец бесславных поколений | R7: 1999 | S7: книга | T7: омонимия не снята | U7: Захваченный порывом и желанием настолько, что потерял всякий контроль над происходящим, я распахнул дверь кабинета и выпалил еще продолжавшей звонить в бухгалтерию Ильиной: «Я спутал. [Анатолий Найман. Славный конец бесславных поколений (1994)] [омонимия не снята]
A8: =ROUND((RAND()*100),2) -> 41.79 | B8: тежоМ велвокЯ а окневокЯ еН | C8: латупс | D8: Не Яковенко, а Яковлев. Может, | E8: спутал | G8: с кем-нибудь? Мать больше ни | H8: Г. Я. Бакланов. Почём фунт лиха (1962) | I8: =IF(R[1]C[1]=RC[1], "", 1) -> 1 | J8: Г. Я. Бакланов | K8: 1923 | L8: Почём фунт лиха | M8: 1962 | N8: художественная | O8: рассказ | Q8: Григорий Яковлевич Бакланов. Пядь земли. Повести. Роман. Рассказы | R8: 1983 | S8: книга | T8: омонимия не снята | U8: Не Яковенко, а Яковлев. Может, спутал с кем-нибудь? Мать больше ни разу его не видела. [Г. Я. Бакланов. Почём фунт лиха (1962)] [омонимия не снята]
A9: =ROUND((RAND()*100),2) -> 9.94 | B9: ен адгокин еыроток хялеравка утевц | C9: ьшеатупс | D9: цвету, акварелях, которые никогда не | E9: спутаешь | G9: с другими. | H9: В. Д. Алейников. Тадзимас (2002) | I9: =IF(R[1]C[1]=RC[1], "", 1) -> 1 | J9: В. Д. Алейников | K9: 1946 | L9: Тадзимас | M9: 2002 | N9: художественная | O9: мемуары | Q9: Алейников Владимир. Тадзимас. М.: Рипол классик, 2013 | R9: 2013 | S9: книга | T9: омонимия не снята | U9: Личность поэта отразилась и в выразительных рисунках карандашом и тушью, и в симпатичных, отчасти сказочных, с элементами наива и ясновиденья, легких, чистых по цвету, акварелях, которые никогда не спутаешь с другими. [В. Д. Алейников. Тадзимас (2002)] [омонимия не снята]
A10: =ROUND((RAND()*100),2) -> 89.96 | B10: и липецс но илмез то | C10: латупс | D10: от земли ― он сцепил и | E10: спутал | G10: травы и переплел их паутиной | H10: Владимир Брагин. В стране дремучих трав (1962) | I10: =IF(R[1]C[1]=RC[1], "", 1) -> 1 | J10: Владимир Брагин | K10: 1896 | L10: В стране дремучих трав | M10: 1962 | N10: художественная | O10: роман | Q10: В. Брагин. В стране дремучих трав | R10: 2004 | S10: книга | T10: омонимия не снята | U10: Но для сооружения этой крепости погребной паук не оторвал ни одной травинки от земли ― он сцепил и спутал травы и переплел их паутиной. [Владимир Брагин. В стране дремучих трав (1962)] [омонимия не снята]
A11: =ROUND((RAND()*100),2) -> 47.18 | B11: ен мек с ин и | C11: театупс | D11: и ни с кем не | E11: спутает | G11: мальчик этот голос! | H11: Валентина Осеева. Динка (1959) | I11: =IF(R[1]C[1]=RC[1], "", 1) -> 1 | J11: Валентина Осеева | K11: 1902 | L11: Динка | M11: 1959 | N11: художественная | O11: роман | Q11: Осеева В. А. Динка | R11: 1991 | S11: книга | T11: омонимия не снята | U11: Никогда и ни с кем не спутает мальчик этот голос! [Валентина Осеева. Динка (1959)] [омонимия не снята]
A12: =ROUND((RAND()*100),2) -> 5.1100000000000003 | B12: ен адгокин акадреч хапаЗ | C12: ьшеатупс | D12: Запах чердака никогда не | E12: спутаешь | G12: с запахом подвала. | H12: Вадим Сидур. Памятник современному состоянию (1973-1974) | I12: =IF(R[1]C[1]=RC[1], "", 1) -> 1 | J12: Вадим Сидур | K12: 1924 | L12: Памятник современному состоянию | M12: 1973-1974 | N12: художественная | O12: роман | Q12: Вадим Сидур. Памятник современному состоянию | R12: 2002 | S12: книга | T12: омонимия не снята | U12: Запах чердака никогда не спутаешь с запахом подвала. [Вадим Сидур. Памятник современному состоянию (1973-1974)] [омонимия не снята]
A13: =ROUND((RAND()*100),2) -> 9.08 | B13: ано отч икат-есв юамуд ен | C13: алатупс | D13: не думаю все-таки, что она | E13: спутала | G13: меня с кем-нибудь другим, таким | H13: Юлий Даниэль. Письма из заключения (1966-1970) | I13: =IF(R[1]C[1]=RC[1], "", 1) -> 1 | J13: Юлий Даниэль | K13: 1925 | L13: Письма из заключения | M13: 1966-1970 | N13: бытовая , нехудожественная | O13: письмо личное | P13: частная жизнь | Q13: Юлий Даниэль. «Я всё сбиваюсь на литературу…» Письма из заключения. Стихи | R13: 2000 | S13: книга | T13: омонимия не снята | U13: Я не думаю все-таки, что она спутала меня с кем-нибудь другим, таким же симпатичным… [Юлий Даниэль. Письма из заключения (1966-1970)] [омонимия не снята]
A14: =ROUND((RAND()*100),2) -> 16.93 | B14: ен иис яинещущО | C14: ьшеатупс | D14: Ощущения сии не | E14: спутаешь | G14: ни с чем и спрашивать | H14: Женщина + мужчина: Секс (форум) (2004) | I14: =IF(R[1]C[1]=RC[1], "", 1) -> 1 | L14: Женщина + мужчина: Секс (форум) | M14: 2004 | N14: электронная коммуникация , нехудожественная | O14: форум | P14: частная жизнь | Q14: Форум на eva.ru | R14: 2005 | S14: электронный текст | T14: омонимия не снята | U14: Ощущения сии не спутаешь ни с чем и спрашивать никого не будешь ― оргазм это был или нет. [Женщина + мужчина: Секс (форум) (2004)] [омонимия не снята]
A15: =ROUND((RAND()*100),2) -> 46.15 | B15: онненмосен ежад И | C15: алатупс | D15: И даже несомненно | E15: спутала | F15: , | G15: если сообщила вам, что я | H15: В. А. Каверин. Перед зеркалом (1965-1970) | I15: =IF(R[1]C[1]=RC[1], "", 1) -> 1 | J15: В. А. Каверин | K15: 1902 | L15: Перед зеркалом | M15: 1965-1970 | N15: художественная | O15: повесть | Q15: В. Каверин. Пурпурный палимпсест | R15: 1997 | S15: книга | T15: омонимия не снята | U15: И даже несомненно спутала, если сообщила вам, что я вскоре снова собираюсь в Париж. [В. А. Каверин. Перед зеркалом (1965-1970)] [омонимия не снята]
A16: =ROUND((RAND()*100),2) -> 12.17 | B16: адохереп у йачулс тотЭ | C16: латупс | D16: Этот случай у перехода | E16: спутал | G16: все мысли. | H16: Юрий Буйда. Город палачей // «Знамя», 2003 | I16: =IF(R[1]C[1]=RC[1], "", 1) -> 1 | J16: Юрий Буйда | K16: 1954 | L16: Город палачей | M16: 2003 | N16: художественная | O16: роман | Q16: «Знамя» | R16: 2003 | S16: журнал | T16: омонимия не снята | U16: Этот случай у перехода спутал все мысли. [Юрий Буйда. Город палачей // «Знамя», 2003] [омонимия не снята]
A17: =ROUND((RAND()*100),2) -> 51.32 | B17: от-мек с сав я ястежаК | C17: латупс | D17: Кажется, я вас с кем-то | E17: спутал | F17: . | H17: В. В. Голявкин. Рисунки на асфальте (1965) | I17: =IF(R[1]C[1]=RC[1], "", 1) -> 1 | J17: В. В. Голявкин | K17: 1929 | L17: Рисунки на асфальте | M17: 1965 | N17: художественная | O17: повесть | Q17: Голявкин В. В. Тетрадки под дождем | R17: 2001 | S17: книга | T17: омонимия не снята | U17: Вздохнул и говорит: — Кажется, я вас с кем-то спутал. [В. В. Голявкин. Рисунки на асфальте (1965)] [омонимия не снята]
A18: =ROUND((RAND()*100),2) -> 50.42 | B18: еН | C18: ьшеатупс | D18: ― Не | E18: спутаешь | F18: … | G18: у вас очень… неконспиративная внешность | H18: Л. К. Чуковская. Прочерк (1980-1994) | I18: =IF(R[1]C[1]=RC[1], "", 1) -> 1 | J18: Л. К. Чуковская | K18: 1907 | L18: Прочерк | M18: 1980-1994 | N18: художественная | O18: повесть | Q18: Лидия Чуковская. Прочерк | R18: 2009 | S18: книга | T18: омонимия не снята | U18: ― Не спутаешь… у вас очень… неконспиративная внешность. [Л. К. Чуковская. Прочерк (1980-1994)] [омонимия не снята]
A19: =ROUND((RAND()*100),2) -> 79.56 | B19: от-мек с еонреван янем ыВ | C19: илатупс | D19: Вы меня, наверное, с кем-то | E19: спутали | F19: . | G19: Вот мои документы!.. | H19: Максим Милованов. Естественный отбор (2000) | I19: =IF(R[1]C[1]=RC[1], "", 1) -> 1 | J19: Максим Милованов | K19: 1969 | L19: Естественный отбор | M19: 2000 | N19: художественная | O19: роман | Q19: Максим Милованов. Естественный отбор | R19: 2000 | S19: книга | T19: омонимия не снята | U19: ― Но уверяю вас, это какая-то ошибка. Вы меня, наверное, с кем-то спутали. Вот мои документы!.. [Максим Милованов. Естественный отбор (2000)] [омонимия не снята]
A20: =ROUND((RAND()*100),2) -> 82.19 | B20: оготслоТ евзаР | C20: ьшеатупс | D20: Разве Толстого | E20: спутаешь | G20: с Достоевским, а Васильева с | H20: Александр Савельев. Аркан для букмекера (2000) | I20: =IF(R[1]C[1]=RC[1], "", 1) -> 1 | J20: Александр Савельев | L20: Аркан для букмекера | M20: 2000 | N20: художественная | O20: роман | Q20: Александр Савельев. Аркан для букмекера | R20: 2000 | S20: книга | T20: омонимия не снята | U20: Разве Толстого спутаешь с Достоевским, а Васильева с Астафьевым? [Александр Савельев. Аркан для букмекера (2000)] [омонимия не снята]
A21: =ROUND((RAND()*100),2) -> 7.07 | B21: увксоМ в недевереп ончобишо мотоп | C21: илатупс | D21: потом ошибочно переведен в Москву ― | E21: спутали | G21: двух Соловьевых, Ивана Соловьева и | H21: Владимир Соловьев. Три еврея, или Утешение в слезах. Роман с эпиграфами (1975-1998) | I21: =IF(R[1]C[1]=RC[1], "", 1) -> 1 | J21: Владимир Соловьев | K21: 1942 | L21: Три еврея, или Утешение в слезах. Роман с эпиграфами | M21: 1975-1998 | N21: художественная | O21: роман | Q21: Владимир Соловьев. Три еврея, или Утешение в слезах. Роман с эпиграфами | R21: 2002 | S21: книга | T21: омонимия не снята | U21: Он был пограничником на финской границе, под Ленинградом, потом ошибочно переведен в Москву ― спутали двух Соловьевых, Ивана Соловьева и Исаака Соловьева, отец уцепился за столицу тогда, как я сейчас ― шел 37-й год, отец попал в кремлевскую охрану, 6 ноября был арестован комендант Москвы, как враг народа: на следующий день был парад, и все подозревали всех. [Владимир Соловьев. Три еврея, или Утешение в слезах. Роман с эпиграфами (1975-1998)] [омонимия не снята]
A22: =ROUND((RAND()*100),2) -> 35.57 | B22: и ыб олитумзов янем онтяорев | C22: олатупс | D22: вероятно, меня возмутило бы и | E22: спутало | G22: бы все впечатление. | H22: В. А. Маклаков. Из воспоминаний (1954) | I22: =IF(R[1]C[1]=RC[1], "", 1) -> 1 | J22: В. А. Маклаков | K22: 1869 | L22: Из воспоминаний | M22: 1954 | N22: публицистика , нехудожественная | O22: мемуары | P22: политика и общественная жизнь, история | Q22: В. А. Маклаков. Из воспоминаний | R22: 1954 | S22: книга | T22: омонимия не снята | U22: К счастью, этого я не видал; зрелище такого грубого насилия, вероятно, меня возмутило бы и спутало бы все впечатление. [В. А. Маклаков. Из воспоминаний (1954)] [омонимия не снята]
A23: =ROUND((RAND()*100),2) -> 19.690000000000001 | B23: ен миьч с ин солог | C23: ьшеатупс | D23: голос ни с чьим не | E23: спутаешь | F23: . | H23: Михаил Чулаки. Примус // «Звезда», 2002 | I23: =IF(R[1]C[1]=RC[1], "", 1) -> 1 | J23: Михаил Чулаки | K23: 1941 | L23: Примус | M23: 2002 | N23: художественная | O23: роман | Q23: «Звезда» | R23: 2002 | S23: журнал | T23: омонимия не снята | U23: Как будто он и сам не узнал бы Шурку ― его голос ни с чьим не спутаешь. [Михаил Чулаки. Примус // «Звезда», 2002] [омонимия не снята]
A24: =ROUND((RAND()*100),2) -> 80.290000000000006 | B24: и емиреМ алатич ен ано | C24: алатупс | D24: она не читала Мериме и | E24: спутала | G24: эту путанку с Долорес Ибаррури | H24: Василий Катанян. Лиля Брик. Жизнь (1999) | I24: =IF(R[1]C[1]=RC[1], "", 1) -> 1 | J24: Василий Катанян | K24: 1924 | L24: Лиля Брик. Жизнь | M24: 1999 | N24: публицистика , нехудожественная | O24: мемуары | Q24: Василий Катанян. Лиля Брик. Жизнь | R24: 2002 | S24: книга | T24: омонимия не снята | U24: «Тут все поняли, что она не читала Мериме и спутала эту путанку с Долорес Ибаррури», ― засмеялась Майя, но вообще ей было не до смеха: следующий спектакль вдруг запретили. [Василий Катанян. Лиля Брик. Жизнь (1999)] [омонимия не снята]
A25: =ROUND((RAND()*100),2) -> 82.63 | B25: ен йешу и восон аз-зИ | C25: ьшеатупс | D25: Из-за носов и ушей не | E25: спутаешь | G25: их ни за что: сразу | H25: Евгений Велтистов. Классные и внеклассные приключения необыкновенных первоклассников (1985) | I25: =IF(R[1]C[1]=RC[1], "", 1) -> 1 | J25: Евгений Велтистов | K25: 1934 | L25: Классные и внеклассные приключения необыкновенных первоклассников | M25: 1985 | N25: художественная | O25: повесть | Q25: Евгений Велтистов. Миллион и один день каникул | R25: 1997 | S25: книга | T25: омонимия не снята | U25: Из-за носов и ушей не спутаешь их ни за что: сразу видно, кто Дыркорыл, а кто Одноух. [Евгений Велтистов. Классные и внеклассные приключения необыкновенных первоклассников (1985)] [омонимия не снята]
A26: =ROUND((RAND()*100),2) -> 76.08 | B26: ыт еж как но яслялвиду | C26: алатупс | D26: удивлялся он, ― как же ты | E26: спутала | F26: … | H26: Дина Рубина. Белая голубка Кордовы (2008-2009) | I26: =IF(R[1]C[1]=RC[1], "", 1) -> 1 | J26: Дина Рубина | K26: 1953 | L26: Белая голубка Кордовы | M26: 2008-2009 | N26: художественная | O26: роман | Q26: Дина Рубина. Белая голубка Кордовы | R26: 2009 | S26: книга | T26: омонимия не снята | U26: ―… Но я же старикашка, ― удивлялся он, ― как же ты спутала… [Дина Рубина. Белая голубка Кордовы (2008-2009)] [омонимия не снята]

Sheet: Таблица авторов сп
A3: Названия строк | B3: Количество по полю Количество
B4: 3
A5: А. И. Пантелеев | B5: 1
A6: А. Н. Бенуа | B6: 1
A7: Александр Архангельский | B7: 1
A8: Александр Иличевский | B8: 1
A9: Александр Ласкин | B9: 1
A10: Александр Михайлов | B10: 2
A11: Александр Савельев | B11: 1
A12: Анатолий Найман | B12: 1
A13: Б. Л. Пастернак | B13: 1
A14: Борис Панкин | B14: 1
A15: В. А. Каверин | B15: 1
A16: В. А. Маклаков | B16: 1
A17: В. А. Солоухин | B17: 1
A18: В. В. Голявкин | B18: 1
A19: В. Д. Алейников | B19: 1
A20: Вадим Сидур | B20: 1
A21: Валентина Осеева | B21: 1
A22: Василий Катанян | B22: 1
A23: Василий Шукшин | B23: 1
A24: Вениамин Смехов | B24: 1
A25: Виктор Конецкий | B25: 2
A26: Владимир Брагин | B26: 1
A27: Владимир Соловьев | B27: 1
A28: Владимир Черкасов | B28: 1
A29: Владислав Крапивин | B29: 1
A30: Г. Я. Бакланов | B30: 1
A31: Дина Рубина | B31: 1
A32: Евгений Велтистов | B32: 1
A33: коллективный | B33: 2
A34: Константин Симонов | B34: 1
A35: Л. К. Чуковская | B35: 1
A36: Лев Дворецкий | B36: 1
A37: Лев Исаков | B37: 1
A38: Максим Милованов | B38: 1
A39: Михаил Бубеннов | B39: 1
A40: Михаил Чулаки | B40: 1
A41: С. А. Дангулов | B41: 1
A42: С. Гедройц | B42: 1
A43: Сергей Каледин | B43: 1
A44: Сергей Петрунин | B44: 1
A45: Феликс Эльдемуров | B45: 1
A46: Юлий Даниэль | B46: 2
A47: Юрий Буйда | B47: 1
A48: (пусто)
A49: Общий итог | B49: 50